{"artifact_count":2,"artifacts":[{"path":"exp3v2_confirmatory_bootstrap.json","sha256":"05a0f4446f8cdf6c20a8cf3e804472ddceb838b708245173906f5f2d81bfa9e8","size_bytes":350285},{"path":"exp3v2_confirmatory_results.json","sha256":"e01b948cc78f2d35e79db4430db530c68cea3381385fb635bb5dd8145a58ffdb","size_bytes":2033}],"inventory_sha256":"d3266329ef9fa782263eefe7ca69fedbdc2bb2cdfec3b7a973a0341c60a2ca83","optional_analyses_included":[],"schema_version":"1.0","status":"COMPLETE_PENDING_RESULTS_FREEZE"}
